{
  "baseline_run_id": "oracle-baseline:cleanroom-oracle-v1",
  "evidence_class": "cleanroom",
  "manifest_data_role": "oracle",
  "manifest_sha256": "6bc86f608f76602331dfed4a1a16df9489e9ee0384cf9689b2a9e006d8273cf5",
  "optimized_run_id": "oracle-optimized:cleanroom-oracle-v1",
  "pairs": [
    {
      "baseline": {
        "case_id": "rv64gc:oracle:bitset:boolean_and:large:baseline",
        "source_group": "sg-b2584e2e7bd6aa328dacc813f9bb23d9085ad2dbe57008452e57125de9f3bbea",
        "source_sha256": "b2584e2e7bd6aa328dacc813f9bb23d9085ad2dbe57008452e57125de9f3bbea"
      },
      "expected_output_sha256": "f9abb6a67fbc14333474e9c978cbc2430d4bfa71c2a55a0b7f3c2b3185706131",
      "family": "bitset",
      "input_sha256": "0a786d78703294eb425663eb6aafb900222f84ea76caa938a51d8d54909cb8aa",
      "optimized": {
        "case_id": "rv64gc:oracle:bitset:boolean_and:large:optimized",
        "source_group": "sg-d17041e20ab0cde38dee25a6fc2ad778cc5fed9cea08733c047f80988d7a49e3",
        "source_sha256": "d17041e20ab0cde38dee25a6fc2ad778cc5fed9cea08733c047f80988d7a49e3"
      },
      "pair_id": "bitset:boolean_and:large",
      "target": "rv64gc"
    },
    {
      "baseline": {
        "case_id": "rv64gc:oracle:bitset:boolean_and:medium:baseline",
        "source_group": "sg-b2584e2e7bd6aa328dacc813f9bb23d9085ad2dbe57008452e57125de9f3bbea",
        "source_sha256": "b2584e2e7bd6aa328dacc813f9bb23d9085ad2dbe57008452e57125de9f3bbea"
      },
      "expected_output_sha256": "a7d044cf96b6a94aec8dd88f15330a29bb58622f339b5bd2f02e714f57737fd4",
      "family": "bitset",
      "input_sha256": "7493da0beb0513ef6614131d3f5c977f8fa1705387f882a7b5709fd6d5048919",
      "optimized": {
        "case_id": "rv64gc:oracle:bitset:boolean_and:medium:optimized",
        "source_group": "sg-d17041e20ab0cde38dee25a6fc2ad778cc5fed9cea08733c047f80988d7a49e3",
        "source_sha256": "d17041e20ab0cde38dee25a6fc2ad778cc5fed9cea08733c047f80988d7a49e3"
      },
      "pair_id": "bitset:boolean_and:medium",
      "target": "rv64gc"
    },
    {
      "baseline": {
        "case_id": "rv64gc:oracle:bitset:boolean_and:small:baseline",
        "source_group": "sg-b2584e2e7bd6aa328dacc813f9bb23d9085ad2dbe57008452e57125de9f3bbea",
        "source_sha256": "b2584e2e7bd6aa328dacc813f9bb23d9085ad2dbe57008452e57125de9f3bbea"
      },
      "expected_output_sha256": "d72739a6addaac8d79ae9510ad8d239066d86d22372c7325f1bb4fb34ad17588",
      "family": "bitset",
      "input_sha256": "9344d008fc57474f20b86778cb9200cb825879dcbef0812c3c4b4f772481d20f",
      "optimized": {
        "case_id": "rv64gc:oracle:bitset:boolean_and:small:optimized",
        "source_group": "sg-d17041e20ab0cde38dee25a6fc2ad778cc5fed9cea08733c047f80988d7a49e3",
        "source_sha256": "d17041e20ab0cde38dee25a6fc2ad778cc5fed9cea08733c047f80988d7a49e3"
      },
      "pair_id": "bitset:boolean_and:small",
      "target": "rv64gc"
    },
    {
      "baseline": {
        "case_id": "rv64gc:oracle:bitset:boolean_or:large:baseline",
        "source_group": "sg-09c24949598ec70dc6f9c7cf1ee3d37646ff42ba834f00889c2ad7b7197b98d1",
        "source_sha256": "09c24949598ec70dc6f9c7cf1ee3d37646ff42ba834f00889c2ad7b7197b98d1"
      },
      "expected_output_sha256": "cf4712f0e1877e2f7b9bb0d86f1071c98dfb52973742fa01f4d66842e4166c3e",
      "family": "bitset",
      "input_sha256": "be28aaaf7bfddbe96ba4e3fdf4c61174f2d92424e8e2c1190daff738396ff913",
      "optimized": {
        "case_id": "rv64gc:oracle:bitset:boolean_or:large:optimized",
        "source_group": "sg-4dce5bf882a40ebc753f1aa7fa9653264a1bdf4fcfbc26ce70f83e7c60155ba9",
        "source_sha256": "4dce5bf882a40ebc753f1aa7fa9653264a1bdf4fcfbc26ce70f83e7c60155ba9"
      },
      "pair_id": "bitset:boolean_or:large",
      "target": "rv64gc"
    },
    {
      "baseline": {
        "case_id": "rv64gc:oracle:bitset:boolean_or:medium:baseline",
        "source_group": "sg-09c24949598ec70dc6f9c7cf1ee3d37646ff42ba834f00889c2ad7b7197b98d1",
        "source_sha256": "09c24949598ec70dc6f9c7cf1ee3d37646ff42ba834f00889c2ad7b7197b98d1"
      },
      "expected_output_sha256": "b5057fa6bffcfeeded45476c2ff057fdf468406f58c37a83f39868f8eff2ad88",
      "family": "bitset",
      "input_sha256": "7b1dd60085a60f9e9c3969fcfc7121bffa4668cb64466974e20222666fbedc27",
      "optimized": {
        "case_id": "rv64gc:oracle:bitset:boolean_or:medium:optimized",
        "source_group": "sg-4dce5bf882a40ebc753f1aa7fa9653264a1bdf4fcfbc26ce70f83e7c60155ba9",
        "source_sha256": "4dce5bf882a40ebc753f1aa7fa9653264a1bdf4fcfbc26ce70f83e7c60155ba9"
      },
      "pair_id": "bitset:boolean_or:medium",
      "target": "rv64gc"
    },
    {
      "baseline": {
        "case_id": "rv64gc:oracle:bitset:boolean_or:small:baseline",
        "source_group": "sg-09c24949598ec70dc6f9c7cf1ee3d37646ff42ba834f00889c2ad7b7197b98d1",
        "source_sha256": "09c24949598ec70dc6f9c7cf1ee3d37646ff42ba834f00889c2ad7b7197b98d1"
      },
      "expected_output_sha256": "8d93ade456ef8a4fdef4601038ad1863dc334233766eda1572f53ef8834a08bb",
      "family": "bitset",
      "input_sha256": "4d6680f47bfcf7de46588959e957e72a219c947df58f2c454712f87cb8997be2",
      "optimized": {
        "case_id": "rv64gc:oracle:bitset:boolean_or:small:optimized",
        "source_group": "sg-4dce5bf882a40ebc753f1aa7fa9653264a1bdf4fcfbc26ce70f83e7c60155ba9",
        "source_sha256": "4dce5bf882a40ebc753f1aa7fa9653264a1bdf4fcfbc26ce70f83e7c60155ba9"
      },
      "pair_id": "bitset:boolean_or:small",
      "target": "rv64gc"
    },
    {
      "baseline": {
        "case_id": "rv64gc:oracle:bitset:boolean_xor:large:baseline",
        "source_group": "sg-fbd8d5aa56cde67bfe2eb859ef2c9ff9f6c4dfe7958d56b94e7d7e612b3ff90d",
        "source_sha256": "fbd8d5aa56cde67bfe2eb859ef2c9ff9f6c4dfe7958d56b94e7d7e612b3ff90d"
      },
      "expected_output_sha256": "09750cb30c4f72fc10428059326edba80e0ea5a2ed17e16cadd16401c8536a11",
      "family": "bitset",
      "input_sha256": "acba9cd853e075fd4c5dcb4d33b3178809202e46bf1471830749b8b580cb5ab1",
      "optimized": {
        "case_id": "rv64gc:oracle:bitset:boolean_xor:large:optimized",
        "source_group": "sg-243a5112f6f79ace87a4d2259d5c2d93ad166244808357d4c664fdabcf13547d",
        "source_sha256": "243a5112f6f79ace87a4d2259d5c2d93ad166244808357d4c664fdabcf13547d"
      },
      "pair_id": "bitset:boolean_xor:large",
      "target": "rv64gc"
    },
    {
      "baseline": {
        "case_id": "rv64gc:oracle:bitset:boolean_xor:medium:baseline",
        "source_group": "sg-fbd8d5aa56cde67bfe2eb859ef2c9ff9f6c4dfe7958d56b94e7d7e612b3ff90d",
        "source_sha256": "fbd8d5aa56cde67bfe2eb859ef2c9ff9f6c4dfe7958d56b94e7d7e612b3ff90d"
      },
      "expected_output_sha256": "ccb43de6fa703da542b7afd72fe2b155fa859f4934ff397402b52f7d5552636c",
      "family": "bitset",
      "input_sha256": "487d29e10be726adb2949eeca8ac727f267746a2368ca8e844eb1903057043ad",
      "optimized": {
        "case_id": "rv64gc:oracle:bitset:boolean_xor:medium:optimized",
        "source_group": "sg-243a5112f6f79ace87a4d2259d5c2d93ad166244808357d4c664fdabcf13547d",
        "source_sha256": "243a5112f6f79ace87a4d2259d5c2d93ad166244808357d4c664fdabcf13547d"
      },
      "pair_id": "bitset:boolean_xor:medium",
      "target": "rv64gc"
    },
    {
      "baseline": {
        "case_id": "rv64gc:oracle:bitset:boolean_xor:small:baseline",
        "source_group": "sg-fbd8d5aa56cde67bfe2eb859ef2c9ff9f6c4dfe7958d56b94e7d7e612b3ff90d",
        "source_sha256": "fbd8d5aa56cde67bfe2eb859ef2c9ff9f6c4dfe7958d56b94e7d7e612b3ff90d"
      },
      "expected_output_sha256": "e957bba9d198a48bb51e3d364fafcf2543b32cecea1b93ef787028cd90a4805b",
      "family": "bitset",
      "input_sha256": "e30f50bbac905eec638ff1a4068b00c6d2afa8374b8703f82f4f25686213bce5",
      "optimized": {
        "case_id": "rv64gc:oracle:bitset:boolean_xor:small:optimized",
        "source_group": "sg-243a5112f6f79ace87a4d2259d5c2d93ad166244808357d4c664fdabcf13547d",
        "source_sha256": "243a5112f6f79ace87a4d2259d5c2d93ad166244808357d4c664fdabcf13547d"
      },
      "pair_id": "bitset:boolean_xor:small",
      "target": "rv64gc"
    },
    {
      "baseline": {
        "case_id": "rv64gc:oracle:boom_ilp:dot_unroll4:large:baseline",
        "source_group": "sg-56b6037c4b241f4ce95fb1a1aab4720746b93fc7d068a056639a477d2ff92f42",
        "source_sha256": "56b6037c4b241f4ce95fb1a1aab4720746b93fc7d068a056639a477d2ff92f42"
      },
      "expected_output_sha256": "c7ea2a0ca5f53e19b15267426800d3e5c3095910c637c8079f09eac47bedd78c",
      "family": "boom_ilp",
      "input_sha256": "8e9f6c1e04a3a307e2abc999d9e598eb4e3f41d3dd31adf573f35b76642c02e8",
      "optimized": {
        "case_id": "rv64gc:oracle:boom_ilp:dot_unroll4:large:optimized",
        "source_group": "sg-b1b12678355e921006b5b5c22f8715c1dd0c1e031d3e03c7ae598c30560329be",
        "source_sha256": "b1b12678355e921006b5b5c22f8715c1dd0c1e031d3e03c7ae598c30560329be"
      },
      "pair_id": "boom_ilp:dot_unroll4:large",
      "target": "rv64gc"
    },
    {
      "baseline": {
        "case_id": "rv64gc:oracle:boom_ilp:dot_unroll4:medium:baseline",
        "source_group": "sg-56b6037c4b241f4ce95fb1a1aab4720746b93fc7d068a056639a477d2ff92f42",
        "source_sha256": "56b6037c4b241f4ce95fb1a1aab4720746b93fc7d068a056639a477d2ff92f42"
      },
      "expected_output_sha256": "c79430a4e43d24bb805a3c2ee1580ab23161d0d1dcd6b9689a428d79df5578ca",
      "family": "boom_ilp",
      "input_sha256": "7d1e4e412013ff7be28886bf8f97a20145a3f9866969a979b2af2b3af4642fe8",
      "optimized": {
        "case_id": "rv64gc:oracle:boom_ilp:dot_unroll4:medium:optimized",
        "source_group": "sg-b1b12678355e921006b5b5c22f8715c1dd0c1e031d3e03c7ae598c30560329be",
        "source_sha256": "b1b12678355e921006b5b5c22f8715c1dd0c1e031d3e03c7ae598c30560329be"
      },
      "pair_id": "boom_ilp:dot_unroll4:medium",
      "target": "rv64gc"
    },
    {
      "baseline": {